{
  "fixture_id": "TC-11",
  "capability": "burden_analysis",
  "operation": "analyze",
  "input": {
    "request_type": "calculate_burden_range",
    "provider_roster_version_iri": "https://kgrid.org/cks/dfu-hbot-burden/provider-rosters/appendix-e/versions/1.0",
    "questionnaire_response": {
      "specification_iri": "https://kgrid.org/cks/dfu-hbot-burden/versions/cks-1.0",
      "questionnaire_status": "completed",
      "response_model_iri": "https://kgrid.org/cks/dfu-hbot-burden/response-models/1.0",
      "provider_roster_version_iri": "https://kgrid.org/cks/dfu-hbot-burden/provider-rosters/appendix-e/versions/1.0",
      "response_projection": {
        "hyperbaric_oxygen_therapy_location": "https://kgrid.org/cks/dfu-hbot-burden/providers/e-001",
        "one_way_miles": 12.5,
        "one_way_travel_minutes": 22,
        "weekday_attendance_difficulty": "some",
        "regimen_weeks": 4,
        "selected_scenario": "shorter"
      },
      "confirmed": true
    },
    "fixed_regimen_range_response": {
      "specification_iri": "https://kgrid.org/cks/dfu-hbot-burden/versions/cks-1.0",
      "response_type": "fixed_regimen_range_response",
      "response_model_iri": "https://kgrid.org/cks/dfu-hbot-burden/response-models/1.0",
      "status": "completed",
      "knowledge_package_iri": "https://kgrid.org/cks/dfu-hbot-burden/knowledge-packages/general-dfu-regimen/versions/1.0",
      "knowledge_scope": "general_not_patient_specific",
      "indication": "diabetes_related_foot_ulcer",
      "shorter_regimen_scenario": {
        "episodes": 30,
        "sessions_per_week": 5,
        "course_weeks": 6.0
      },
      "longer_regimen_scenario": {
        "episodes": 40,
        "sessions_per_week": 5,
        "course_weeks": 8.0
      },
      "combined_range": {
        "episodes": [
          30,
          40
        ],
        "sessions_per_week": 5,
        "course_weeks": [
          6.0,
          8.0
        ]
      },
      "scheduled_facility_hours_per_episode": {
        "value": 3.0,
        "unit": "h"
      },
      "tailored_to_patient": false,
      "display_label": "General DFU HBOT planning range: approximately 30–40 episodes, usually five per week, over approximately 6–8 weeks."
    }
  },
  "dependency_state": {
    "provider_roster": "available_valid"
  },
  "expected": {
    "result_instance_iri": "https://kgrid.org/cks/dfu-hbot-burden/result-instances/78dd0801-9250-4b5b-8462-c09d6408d02e",
    "specification_iri": "https://kgrid.org/cks/dfu-hbot-burden/versions/cks-1.0",
    "result_model_iri": "https://kgrid.org/cks/dfu-hbot-burden/output-models/1.0",
    "issued_at": "2026-07-31T14:25:36.123Z",
    "provenance": {
      "engine_implementation_iri": "https://example.org/dfu-hbot-engine/reference",
      "engine_implementation_version": "1.0.0-fixture",
      "specification_iri": "https://kgrid.org/cks/dfu-hbot-burden/versions/cks-1.0",
      "schema_bundle_iri": "https://kgrid.org/cks/dfu-hbot-burden/schema-bundles/versions/1.0",
      "fixture_bundle_iri": "https://kgrid.org/cks/dfu-hbot-burden/conformance-fixtures/versions/1.0",
      "identifier_dependency_manifest_iri": "https://kgrid.org/cks/dfu-hbot-burden/identifier-dependency-manifests/versions/1.0",
      "provider_roster_version_iri": "https://kgrid.org/cks/dfu-hbot-burden/provider-rosters/appendix-e/versions/1.0",
      "input_received_at": "2026-07-31T14:25:36.100Z",
      "input_fingerprint": {
        "algorithm": "SHA-256",
        "canonicalization": "RFC8785",
        "value": "310e5b39be2bc28f52c85ba91b5e92be87b034bc9c380f887a3d83c09d1fd895"
      },
      "provider_roster_fingerprint": {
        "algorithm": "SHA-256",
        "canonicalization": "none",
        "value": null
      },
      "deterministic_result_fingerprint": {
        "algorithm": "SHA-256",
        "canonicalization": "RFC8785",
        "value": "6dfb60032c51e750975e1896ed6f7b1313ed1bf28632bd4a595a8092e793d565"
      }
    },
    "status": "error",
    "result_code": "ERR-04",
    "objective_burden": null,
    "weekday_attendance_feasibility": null,
    "execution_burden_level": null,
    "sensitivity": null,
    "assumptions": [],
    "evidence_sources": [],
    "error": {
      "code": "ERR-04",
      "status": "error",
      "error_field": "regimen_weeks",
      "message": "Unexpected input property is not permitted."
    },
    "warnings": []
  },
  "execution_context": {
    "engine_implementation_iri": "https://example.org/dfu-hbot-engine/reference",
    "engine_implementation_version": "1.0.0-fixture",
    "input_received_at": "2026-07-31T14:25:36.100Z",
    "issued_at": "2026-07-31T14:25:36.123Z",
    "result_instance_iri": "https://kgrid.org/cks/dfu-hbot-burden/result-instances/78dd0801-9250-4b5b-8462-c09d6408d02e"
  }
}
