{
  "fixture_id": "TC-20",
  "capability": "burden_analysis",
  "operation": "analyze",
  "input": {
    "request_type": "calculate_burden_range",
    "provider_roster_version_iri": "https://kgrid.org/cks/dfu-hbot-burden/provider-rosters/appendix-e/versions/1.0",
    "questionnaire_response": {
      "specification_iri": "https://kgrid.org/cks/dfu-hbot-burden/versions/cks-1.0",
      "questionnaire_status": "completed",
      "response_model_iri": "https://kgrid.org/cks/dfu-hbot-burden/response-models/1.0",
      "provider_roster_version_iri": "https://kgrid.org/cks/dfu-hbot-burden/provider-rosters/appendix-e/versions/1.0",
      "response_projection": {
        "hyperbaric_oxygen_therapy_location": "https://kgrid.org/cks/dfu-hbot-burden/providers/e-001",
        "one_way_miles": 30,
        "one_way_travel_minutes": 90,
        "weekday_attendance_difficulty": "none"
      },
      "confirmed": true
    },
    "fixed_regimen_range_response": {
      "specification_iri": "https://kgrid.org/cks/dfu-hbot-burden/versions/cks-1.0",
      "response_type": "fixed_regimen_range_response",
      "response_model_iri": "https://kgrid.org/cks/dfu-hbot-burden/response-models/1.0",
      "status": "completed",
      "knowledge_package_iri": "https://kgrid.org/cks/dfu-hbot-burden/knowledge-packages/general-dfu-regimen/versions/1.0",
      "knowledge_scope": "general_not_patient_specific",
      "indication": "diabetes_related_foot_ulcer",
      "shorter_regimen_scenario": {
        "episodes": 30,
        "sessions_per_week": 5,
        "course_weeks": 6.0
      },
      "longer_regimen_scenario": {
        "episodes": 40,
        "sessions_per_week": 5,
        "course_weeks": 8.0
      },
      "combined_range": {
        "episodes": [
          30,
          40
        ],
        "sessions_per_week": 5,
        "course_weeks": [
          6.0,
          8.0
        ]
      },
      "scheduled_facility_hours_per_episode": {
        "value": 3.0,
        "unit": "h"
      },
      "tailored_to_patient": false,
      "display_label": "General DFU HBOT planning range: approximately 30–40 episodes, usually five per week, over approximately 6–8 weeks."
    }
  },
  "dependency_state": {
    "provider_roster": "available_valid"
  },
  "expected": {
    "result_instance_iri": "https://kgrid.org/cks/dfu-hbot-burden/result-instances/d2ef93cc-42d4-4278-8ae2-7804071e4549",
    "specification_iri": "https://kgrid.org/cks/dfu-hbot-burden/versions/cks-1.0",
    "result_model_iri": "https://kgrid.org/cks/dfu-hbot-burden/output-models/1.0",
    "issued_at": "2026-07-31T14:25:36.123Z",
    "provenance": {
      "engine_implementation_iri": "https://example.org/dfu-hbot-engine/reference",
      "engine_implementation_version": "1.0.0-fixture",
      "specification_iri": "https://kgrid.org/cks/dfu-hbot-burden/versions/cks-1.0",
      "schema_bundle_iri": "https://kgrid.org/cks/dfu-hbot-burden/schema-bundles/versions/1.0",
      "fixture_bundle_iri": "https://kgrid.org/cks/dfu-hbot-burden/conformance-fixtures/versions/1.0",
      "identifier_dependency_manifest_iri": "https://kgrid.org/cks/dfu-hbot-burden/identifier-dependency-manifests/versions/1.0",
      "provider_roster_version_iri": "https://kgrid.org/cks/dfu-hbot-burden/provider-rosters/appendix-e/versions/1.0",
      "input_received_at": "2026-07-31T14:25:36.100Z",
      "input_fingerprint": {
        "algorithm": "SHA-256",
        "canonicalization": "RFC8785",
        "value": "dd94cdf22a67337bc2f4621502c2cb1b3660578f2b1d18150d1744cf6d0c4371"
      },
      "provider_roster_fingerprint": {
        "algorithm": "SHA-256",
        "canonicalization": "RFC8785",
        "value": "2002bd086333c6857c0ffd6c1b31fd08d1de4385d1846c0aba89f0129dd18d37"
      },
      "deterministic_result_fingerprint": {
        "algorithm": "SHA-256",
        "canonicalization": "RFC8785",
        "value": "3d6a28f6867ba86f09bd1e43ce9432922d45c3b0051e8b3dd8b0f062d3b44b81"
      }
    },
    "status": "completed",
    "result_code": "RESULT-VERY-HIGH-EXECUTION-BURDEN",
    "objective_burden": {
      "fixed_regimen_range_response": {
        "specification_iri": "https://kgrid.org/cks/dfu-hbot-burden/versions/cks-1.0",
        "response_type": "fixed_regimen_range_response",
        "response_model_iri": "https://kgrid.org/cks/dfu-hbot-burden/response-models/1.0",
        "status": "completed",
        "knowledge_package_iri": "https://kgrid.org/cks/dfu-hbot-burden/knowledge-packages/general-dfu-regimen/versions/1.0",
        "knowledge_scope": "general_not_patient_specific",
        "indication": "diabetes_related_foot_ulcer",
        "shorter_regimen_scenario": {
          "episodes": 30,
          "sessions_per_week": 5,
          "course_weeks": 6.0
        },
        "longer_regimen_scenario": {
          "episodes": 40,
          "sessions_per_week": 5,
          "course_weeks": 8.0
        },
        "combined_range": {
          "episodes": [
            30,
            40
          ],
          "sessions_per_week": 5,
          "course_weeks": [
            6.0,
            8.0
          ]
        },
        "scheduled_facility_hours_per_episode": {
          "value": 3.0,
          "unit": "h"
        },
        "tailored_to_patient": false,
        "display_label": "General DFU HBOT planning range: approximately 30–40 episodes, usually five per week, over approximately 6–8 weeks."
      },
      "hyperbaric_oxygen_therapy_location_reference": {
        "provider_roster_version_iri": "https://kgrid.org/cks/dfu-hbot-burden/provider-rosters/appendix-e/versions/1.0",
        "roster_record_iri": "https://kgrid.org/cks/dfu-hbot-burden/provider-rosters/appendix-e/versions/1.0/records/e-001",
        "provider_iri": "https://kgrid.org/cks/dfu-hbot-burden/providers/e-001",
        "compact_id": "E-001",
        "facility_listing": "Center for Wound Care & Hyperbaric Medicine / Springhill Medical Center",
        "jurisdiction": "Alabama",
        "address_status": "candidate",
        "normalized_address_candidate": "3719 Dauphin St, Mobile, Alabama 36608, United States"
      },
      "reported_one_way_travel": {
        "miles": 30,
        "minutes": 90
      },
      "burden_by_regimen_scenario": {
        "shorter_regimen": {
          "episodes": 30,
          "course_weeks": 6.0,
          "travel_hours": 90,
          "facility_hours": 90,
          "total_patient_hours": 180,
          "course_miles": 1800
        },
        "longer_regimen": {
          "episodes": 40,
          "course_weeks": 8.0,
          "travel_hours": 120,
          "facility_hours": 120,
          "total_patient_hours": 240,
          "course_miles": 2400
        }
      },
      "overall_burden_range": {
        "episodes": [
          30,
          40
        ],
        "travel_hours": [
          90,
          120
        ],
        "facility_hours": [
          90,
          120
        ],
        "total_patient_hours": [
          180,
          240
        ],
        "course_miles": [
          1800,
          2400
        ]
      },
      "travel_band": {
        "value": "very_high",
        "basis": "reported_one_way_minutes_doubled"
      }
    },
    "weekday_attendance_feasibility": {
      "reported_value": "none",
      "display_text": "No weekday-attendance difficulty reported"
    },
    "execution_burden_level": {
      "score": 4,
      "category": "very_high_execution_burden",
      "primary_driver": "Very-high reported travel time (3 round-trip hours)",
      "secondary_driver": "Repeated attendance (30–40 episodes; five per week)",
      "display_text": "Very high execution burden"
    },
    "sensitivity": {
      "longer_minus_shorter_episodes": 10,
      "incremental_travel_hours": 30,
      "incremental_facility_hours": 30,
      "incremental_total_hours": 60,
      "incremental_miles": 600,
      "incremental_weeks": 2.0
    },
    "assumptions": [
      {
        "code": "ASM-01",
        "text": "General DFU planning regimen range of 30–40 episodes at five sessions per week is used; it was not selected or calculated for the patient."
      },
      {
        "code": "ASM-02",
        "text": "A single fixed three-hour scheduled facility block per treatment episode is used as a conservative, realistic worst-case planning assumption. It is not a validated DFU-specific door-to-door elapsed-time estimate."
      },
      {
        "code": "ASM-03",
        "text": "Round trip is estimated as two times the patient-reported usual one-way miles and minutes."
      },
      {
        "code": "ASM-04",
        "text": "Reported travel values are planning estimates and are not independently verified by the engine."
      }
    ],
    "evidence_sources": [],
    "error": null,
    "warnings": []
  },
  "execution_context": {
    "engine_implementation_iri": "https://example.org/dfu-hbot-engine/reference",
    "engine_implementation_version": "1.0.0-fixture",
    "input_received_at": "2026-07-31T14:25:36.100Z",
    "issued_at": "2026-07-31T14:25:36.123Z",
    "result_instance_iri": "https://kgrid.org/cks/dfu-hbot-burden/result-instances/d2ef93cc-42d4-4278-8ae2-7804071e4549"
  }
}
