{
  "fixture_id": "TC-15",
  "capability": "burden_analysis",
  "operation": "analyze",
  "input": null,
  "dependency_state": {
    "provider_roster": "available_valid"
  },
  "expected": {
    "result_instance_iri": "https://kgrid.org/cks/dfu-hbot-burden/result-instances/17be9fd6-ad6b-450e-9eda-9fbc27cbd30b",
    "specification_iri": "https://kgrid.org/cks/dfu-hbot-burden/versions/cks-1.0",
    "result_model_iri": "https://kgrid.org/cks/dfu-hbot-burden/output-models/1.0",
    "issued_at": "2026-07-31T14:25:36.123Z",
    "provenance": {
      "engine_implementation_iri": "https://example.org/dfu-hbot-engine/reference",
      "engine_implementation_version": "1.0.0-fixture",
      "specification_iri": "https://kgrid.org/cks/dfu-hbot-burden/versions/cks-1.0",
      "schema_bundle_iri": "https://kgrid.org/cks/dfu-hbot-burden/schema-bundles/versions/1.0",
      "fixture_bundle_iri": "https://kgrid.org/cks/dfu-hbot-burden/conformance-fixtures/versions/1.0",
      "identifier_dependency_manifest_iri": "https://kgrid.org/cks/dfu-hbot-burden/identifier-dependency-manifests/versions/1.0",
      "provider_roster_version_iri": "https://kgrid.org/cks/dfu-hbot-burden/provider-rosters/appendix-e/versions/1.0",
      "input_received_at": "2026-07-31T14:25:36.100Z",
      "input_fingerprint": {
        "algorithm": "SHA-256",
        "canonicalization": "raw-octets",
        "value": "7ce1a8f9bfe362681831ecc83b6327b71c43afb2736b94967abd4ba1aafaec47"
      },
      "provider_roster_fingerprint": {
        "algorithm": "SHA-256",
        "canonicalization": "none",
        "value": null
      },
      "deterministic_result_fingerprint": {
        "algorithm": "SHA-256",
        "canonicalization": "RFC8785",
        "value": "46405da8bff8afa0b10df925d0172a54520ecf5ebad523882d4fc6b9517dff6a"
      }
    },
    "status": "error",
    "result_code": "ERR-06",
    "objective_burden": null,
    "weekday_attendance_feasibility": null,
    "execution_burden_level": null,
    "sensitivity": null,
    "assumptions": [],
    "evidence_sources": [],
    "error": {
      "code": "ERR-06",
      "status": "error",
      "error_field": "hyperbaric_oxygen_therapy_location",
      "message": "Duplicate property name is not permitted."
    },
    "warnings": []
  },
  "execution_context": {
    "engine_implementation_iri": "https://example.org/dfu-hbot-engine/reference",
    "engine_implementation_version": "1.0.0-fixture",
    "input_received_at": "2026-07-31T14:25:36.100Z",
    "issued_at": "2026-07-31T14:25:36.123Z",
    "result_instance_iri": "https://kgrid.org/cks/dfu-hbot-burden/result-instances/17be9fd6-ad6b-450e-9eda-9fbc27cbd30b"
  },
  "input_json": "{\"request_type\":\"calculate_burden_range\",\"provider_roster_version_iri\":\"https://kgrid.org/cks/dfu-hbot-burden/provider-rosters/appendix-e/versions/1.0\",\"questionnaire_response\":{\"response_projection\":{\"hyperbaric_oxygen_therapy_location\":\"https://kgrid.org/cks/dfu-hbot-burden/providers/e-001\",\"hyperbaric_oxygen_therapy_location\":\"https://kgrid.org/cks/dfu-hbot-burden/providers/e-002\"}}}"
}
