{
  "fixture_id": "TC-44",
  "capability": "burden_analysis",
  "operation": "validate_audit",
  "input": {
    "result": {
      "result_instance_iri": "https://kgrid.org/cks/dfu-hbot-burden/result-instances/37ba0c00-a5b5-4d70-aeb1-2f75512b4363",
      "specification_iri": "https://kgrid.org/cks/dfu-hbot-burden/versions/cks-1.0",
      "result_model_iri": "https://kgrid.org/cks/dfu-hbot-burden/output-models/1.0",
      "issued_at": "2026-07-31T14:25:36.123Z",
      "provenance": {
        "engine_implementation_iri": "https://example.org/dfu-hbot-engine/reference",
        "engine_implementation_version": "1.0.0-fixture",
        "specification_iri": "https://kgrid.org/cks/dfu-hbot-burden/versions/cks-1.0",
        "schema_bundle_iri": "https://kgrid.org/cks/dfu-hbot-burden/schema-bundles/versions/1.0",
        "fixture_bundle_iri": "https://kgrid.org/cks/dfu-hbot-burden/conformance-fixtures/versions/1.0",
        "identifier_dependency_manifest_iri": "https://kgrid.org/cks/dfu-hbot-burden/identifier-dependency-manifests/versions/1.0",
        "provider_roster_version_iri": "https://kgrid.org/cks/dfu-hbot-burden/provider-rosters/appendix-e/versions/1.0",
        "input_received_at": "2026-07-31T14:25:36.100Z",
        "input_fingerprint": {
          "algorithm": "SHA-256",
          "canonicalization": "RFC8785",
          "value": "ff32d6d2c756b4962cca8740e0617ff01a454c54bb924ff53fea6c693e4f7bf9"
        },
        "provider_roster_fingerprint": {
          "algorithm": "SHA-256",
          "canonicalization": "RFC8785",
          "value": "0000000000000000000000000000000000000000000000000000000000000000"
        },
        "deterministic_result_fingerprint": {
          "algorithm": "SHA-256",
          "canonicalization": "RFC8785",
          "value": "347e6b95f373c040827dc3fbcefd2723bb9110f889064e7e1f4e8befe4fa50c5"
        }
      },
      "status": "completed",
      "result_code": "RESULT-MODERATE-EXECUTION-BURDEN",
      "objective_burden": {
        "fixed_regimen_range_response": {
          "specification_iri": "https://kgrid.org/cks/dfu-hbot-burden/versions/cks-1.0",
          "response_type": "fixed_regimen_range_response",
          "response_model_iri": "https://kgrid.org/cks/dfu-hbot-burden/response-models/1.0",
          "status": "completed",
          "knowledge_package_iri": "https://kgrid.org/cks/dfu-hbot-burden/knowledge-packages/general-dfu-regimen/versions/1.0",
          "knowledge_scope": "general_not_patient_specific",
          "indication": "diabetes_related_foot_ulcer",
          "shorter_regimen_scenario": {
            "episodes": 30,
            "sessions_per_week": 5,
            "course_weeks": 6.0
          },
          "longer_regimen_scenario": {
            "episodes": 40,
            "sessions_per_week": 5,
            "course_weeks": 8.0
          },
          "combined_range": {
            "episodes": [
              30,
              40
            ],
            "sessions_per_week": 5,
            "course_weeks": [
              6.0,
              8.0
            ]
          },
          "scheduled_facility_hours_per_episode": {
            "value": 3.0,
            "unit": "h"
          },
          "tailored_to_patient": false,
          "display_label": "General DFU HBOT planning range: approximately 30–40 episodes, usually five per week, over approximately 6–8 weeks."
        },
        "hyperbaric_oxygen_therapy_location_reference": {
          "provider_roster_version_iri": "https://kgrid.org/cks/dfu-hbot-burden/provider-rosters/appendix-e/versions/1.0",
          "roster_record_iri": "https://kgrid.org/cks/dfu-hbot-burden/provider-rosters/appendix-e/versions/1.0/records/e-001",
          "provider_iri": "https://kgrid.org/cks/dfu-hbot-burden/providers/e-001",
          "compact_id": "E-001",
          "facility_listing": "Center for Wound Care & Hyperbaric Medicine / Springhill Medical Center",
          "jurisdiction": "Alabama",
          "address_status": "candidate",
          "normalized_address_candidate": "3719 Dauphin St, Mobile, Alabama 36608, United States"
        },
        "reported_one_way_travel": {
          "miles": 12.5,
          "minutes": 22
        },
        "burden_by_regimen_scenario": {
          "shorter_regimen": {
            "episodes": 30,
            "course_weeks": 6.0,
            "travel_hours": 22,
            "facility_hours": 90,
            "total_patient_hours": 112,
            "course_miles": 750
          },
          "longer_regimen": {
            "episodes": 40,
            "course_weeks": 8.0,
            "travel_hours": 30,
            "facility_hours": 120,
            "total_patient_hours": 150,
            "course_miles": 1000
          }
        },
        "overall_burden_range": {
          "episodes": [
            30,
            40
          ],
          "travel_hours": [
            22,
            30
          ],
          "facility_hours": [
            90,
            120
          ],
          "total_patient_hours": [
            112,
            150
          ],
          "course_miles": [
            750,
            1000
          ]
        },
        "travel_band": {
          "value": "low",
          "basis": "reported_one_way_minutes_doubled"
        }
      },
      "weekday_attendance_feasibility": {
        "reported_value": "some",
        "display_text": "Some weekday-attendance difficulty reported"
      },
      "execution_burden_level": {
        "score": 2,
        "category": "moderate_execution_burden",
        "primary_driver": "Some weekday-attendance difficulty",
        "secondary_driver": "Repeated attendance (30–40 episodes; five per week)",
        "display_text": "Moderate execution burden"
      },
      "sensitivity": {
        "longer_minus_shorter_episodes": 10,
        "incremental_travel_hours": 7.3,
        "incremental_facility_hours": 30,
        "incremental_total_hours": 37,
        "incremental_miles": 250,
        "incremental_weeks": 2.0
      },
      "assumptions": [
        {
          "code": "ASM-01",
          "text": "General DFU planning regimen range of 30–40 episodes at five sessions per week is used; it was not selected or calculated for the patient."
        },
        {
          "code": "ASM-02",
          "text": "A single fixed three-hour scheduled facility block per treatment episode is used as a conservative, realistic worst-case planning assumption. It is not a validated DFU-specific door-to-door elapsed-time estimate."
        },
        {
          "code": "ASM-03",
          "text": "Round trip is estimated as two times the patient-reported usual one-way miles and minutes."
        },
        {
          "code": "ASM-04",
          "text": "Reported travel values are planning estimates and are not independently verified by the engine."
        }
      ],
      "evidence_sources": [],
      "error": null,
      "warnings": []
    },
    "retained_input": {
      "request_type": "calculate_burden_range",
      "provider_roster_version_iri": "https://kgrid.org/cks/dfu-hbot-burden/provider-rosters/appendix-e/versions/1.0",
      "questionnaire_response": {
        "specification_iri": "https://kgrid.org/cks/dfu-hbot-burden/versions/cks-1.0",
        "questionnaire_status": "completed",
        "response_model_iri": "https://kgrid.org/cks/dfu-hbot-burden/response-models/1.0",
        "provider_roster_version_iri": "https://kgrid.org/cks/dfu-hbot-burden/provider-rosters/appendix-e/versions/1.0",
        "response_projection": {
          "hyperbaric_oxygen_therapy_location": "https://kgrid.org/cks/dfu-hbot-burden/providers/e-001",
          "one_way_miles": 12.5,
          "one_way_travel_minutes": 22,
          "weekday_attendance_difficulty": "some"
        },
        "confirmed": true
      },
      "fixed_regimen_range_response": {
        "specification_iri": "https://kgrid.org/cks/dfu-hbot-burden/versions/cks-1.0",
        "response_type": "fixed_regimen_range_response",
        "response_model_iri": "https://kgrid.org/cks/dfu-hbot-burden/response-models/1.0",
        "status": "completed",
        "knowledge_package_iri": "https://kgrid.org/cks/dfu-hbot-burden/knowledge-packages/general-dfu-regimen/versions/1.0",
        "knowledge_scope": "general_not_patient_specific",
        "indication": "diabetes_related_foot_ulcer",
        "shorter_regimen_scenario": {
          "episodes": 30,
          "sessions_per_week": 5,
          "course_weeks": 6.0
        },
        "longer_regimen_scenario": {
          "episodes": 40,
          "sessions_per_week": 5,
          "course_weeks": 8.0
        },
        "combined_range": {
          "episodes": [
            30,
            40
          ],
          "sessions_per_week": 5,
          "course_weeks": [
            6.0,
            8.0
          ]
        },
        "scheduled_facility_hours_per_episode": {
          "value": 3.0,
          "unit": "h"
        },
        "tailored_to_patient": false,
        "display_label": "General DFU HBOT planning range: approximately 30–40 episodes, usually five per week, over approximately 6–8 weeks."
      }
    },
    "retained_provider_roster_sha256": "2002bd086333c6857c0ffd6c1b31fd08d1de4385d1846c0aba89f0129dd18d37"
  },
  "dependency_state": {
    "provider_roster": "available_valid"
  },
  "expected": {
    "status": "audit_invalid",
    "failure_code": "AUDIT-05",
    "message": "Provider-roster fingerprint verification failed."
  },
  "execution_context": {
    "engine_implementation_iri": "https://example.org/dfu-hbot-engine/reference",
    "engine_implementation_version": "1.0.0-fixture",
    "input_received_at": "2026-07-31T14:25:36.100Z",
    "issued_at": "2026-07-31T14:25:36.123Z",
    "result_instance_iri": "https://kgrid.org/cks/dfu-hbot-burden/result-instances/012b7807-a759-40c7-b1f0-27dcf0b28672"
  }
}
