{
  "fixture_id": "RR-06",
  "capability": "regimen_range",
  "operation": "validate_response",
  "input": {
    "specification_iri": "https://kgrid.org/cks/dfu-hbot-burden/versions/cks-1.0",
    "response_type": "fixed_regimen_range_response",
    "response_model_iri": "https://kgrid.org/cks/dfu-hbot-burden/response-models/1.0",
    "status": "completed",
    "knowledge_package_iri": "https://kgrid.org/cks/dfu-hbot-burden/knowledge-packages/general-dfu-regimen/versions/1.0",
    "knowledge_scope": "general_not_patient_specific",
    "indication": "diabetes_related_foot_ulcer",
    "shorter_regimen_scenario": {
      "episodes": 30,
      "sessions_per_week": 5,
      "course_weeks": 7.0
    },
    "longer_regimen_scenario": {
      "episodes": 40,
      "sessions_per_week": 5,
      "course_weeks": 8.0
    },
    "combined_range": {
      "episodes": [
        30,
        40
      ],
      "sessions_per_week": 5,
      "course_weeks": [
        6.0,
        8.0
      ]
    },
    "scheduled_facility_hours_per_episode": {
      "value": 3.0,
      "unit": "h"
    },
    "tailored_to_patient": false,
    "display_label": "General DFU HBOT planning range: approximately 30–40 episodes, usually five per week, over approximately 6–8 weeks."
  },
  "dependency_state": {
    "provider_roster": "available_valid"
  },
  "expected": {
    "outcome": "error",
    "error": {
      "code": "ERR-09",
      "status": "error",
      "error_field": "shorter_regimen_scenario.course_weeks",
      "message": "Input value is outside the closed value set or constraint."
    },
    "response": null
  }
}
