{
  "fixture_id": "QT-02",
  "capability": "burden_questionnaire",
  "operation": "apply_events",
  "input": [
    {
      "event": "confirm_provider",
      "provider_iri": "https://kgrid.org/cks/dfu-hbot-burden/providers/e-001"
    },
    {
      "event": "answer",
      "question": "Q02",
      "value": 12.5
    },
    {
      "event": "answer",
      "question": "Q03",
      "value": 22
    },
    {
      "event": "answer",
      "question": "Q04",
      "value": "some"
    },
    {
      "event": "abandon"
    }
  ],
  "dependency_state": {
    "provider_roster": "available_valid"
  },
  "expected": {
    "state": "QTS-ABANDONED",
    "answers": {
      "Q01": null,
      "Q02": null,
      "Q03": null,
      "Q04": null
    },
    "registered_response": null,
    "analysis_invoked": false,
    "display_requirements": []
  }
}
