{
  "fixture_id": "QT-16",
  "capability": "burden_questionnaire",
  "operation": "apply_events",
  "input": [
    {
      "event": "confirm_provider",
      "provider_iri": "https://kgrid.org/cks/dfu-hbot-burden/providers/e-001"
    },
    {
      "event": "answer",
      "question": "Q02",
      "value": 12.5
    },
    {
      "event": "answer",
      "question": "Q03",
      "value": 22
    },
    {
      "event": "answer",
      "question": "Q04",
      "value": "difficult"
    }
  ],
  "dependency_state": {
    "provider_roster": "available_valid"
  },
  "expected": {
    "state": "QNTS-03",
    "answers": {
      "Q01": "https://kgrid.org/cks/dfu-hbot-burden/providers/e-001",
      "Q02": 12.5,
      "Q03": 22,
      "Q04": null
    },
    "registered_response": null,
    "analysis_invoked": false,
    "display_requirements": [
      "Q04_closed_values_required"
    ]
  }
}
